<deployment xmlns="urn:jboss:messaging"
            xmlns:xsi="http://www.w3.org/2001/XMLSchema-instance"
            xsi:schemaLocation="urn:jboss:messaging ../schemas/jbm-jms.xsd ">
   <!--the connection factory used by the example-->
   <connection-factory name="ConnectionFactory">
      <discovery-group-ref discovery-group-name="my-discovery-group"/>
      <entry name="ConnectionFactory"/>
      <entry name="XAConnectionFactory"/>
      <entry name="java:/ConnectionFactory"/>
      <entry name="java:/XAConnectionFactory"/>      
   </connection-factory>

   <!--the queue used by the example-->
   <queue name="exampleQueue">
      <entry name="/queue/exampleQueue"/>
   </queue>

</deployment>